Titles,Companies,Currencies,Salaries,Closing Dates
Data Analyst Part Time Intern,Landcrowd Limited,HKD ($),400 per day,2024-09-19
Community Associate (Part time),Access Benefit Limited,HKD ($),Negotiable,2024-09-20
2024/25財富管理實習生,Roy Financial Consulting,HKD ($),15K - 50K per month,2024-09-20
PMO (Project Management Office) Trainee - Enterprise CRM / ERP / HCM,Global Sharp International Limited,HKD ($),25K - 27K per month,2024-09-05
課餘託管服務 – 兼職課託小組導師,YMCA of Hong Kong,HKD ($),80 - 100 per hour,2024-09-20
Site Logistics Technician,Trinseo (Hong Kong) Limited,HKD ($),19K - 22K per month,2024-09-20
"Project Intern, Property & Casualty Underwriting (Catastrophe Analytic)",Peak Reinsurance Company Limited,HKD ($),Negotiable,2024-09-20
Xiaomi 2025 Future Star Program,Xiaomi Corporation,CNY (¥),40K - 100K per month,2024-09-20
中小學導師(6天) (鑽石山),Bright Union International Limited,HKD ($),20K per month,2024-09-04
Process Technician,Trinseo (Hong Kong) Limited,HKD ($),19K - 22K per month,2024-09-20
初中數理導師(6天) (鑽石山),Bright Union International Limited,HKD ($),20K per month,2024-09-06
Site Logistics Technician,Trinseo (Hong Kong) Limited,HKD ($),19K - 22K per month,2024-09-20
中小學導師(6天) (鑽石山),Bright Union International Limited,HKD ($),20K per month,2024-09-04
Xiaomi 2025 Future Star Program,Xiaomi Corporation,CNY (¥),40K - 100K per month,2024-09-20
Process Technician,Trinseo (Hong Kong) Limited,HKD ($),19K - 22K per month,2024-09-20
"Project Intern, Property & Casualty Underwriting (Catastrophe Analytic)",Peak Reinsurance Company Limited,HKD ($),Negotiable,2024-09-20
Programmer,Tradelink Technologies Limited,HKD ($),80 - 85 per hour,2024-09-15
Junior Designer,DIA (ASIA PACIFIC) COMPANY LIMITED,HKD ($),14K - 16.5K per month,2024-09-14
Part-time - Membership Services Assistant (Hotline),The Hong Kong Jockey Club,HKD ($),Negotiable,2024-09-16
Business Development Executive,IT Channel (Asia) Limited,HKD ($),17K - 20K per month,2024-09-20
Assistant Software Engineer / Software Engineer,IT Channel (Asia) Limited,HKD ($),17K - 20K per month,2024-09-20
Project Assistant in Department of Curriculum and Instruction (Ref: 2400936),The Education University of Hong Kong,HKD ($),21.4K per month,2024-08-28
Sales Assistant,Convergint (Hong Kong) Limited,HKD ($),15K - 18K per month,2024-08-31
Assistant,Alles Compliance Consulting Limited,HKD ($),70 - 90 per hour,2024-09-19
Analyst Programmer Trainee,Togo Pacific Limited,HKD ($),Negotiable,2024-09-15
Quality Controller Assistant,Tung Chun Management Services Co. Limited,HKD ($),16K - 18K per month,2024-09-19
數學及英文導師 Math and English Tutor/Teacher (大角咀/奧運站),BRAINKEY EDUCATION LIMITED,HKD ($),17K - 25K per month,2024-09-05
Accounts & Administrative Assistant,TUVE Limited,HKD ($),15K - 16K per month,2024-08-27
Associate Officer – Finance & Accounting,HKR International Limited,HKD ($),Negotiable,2024-09-19
2024/25Wealth Management Internship,Roy Financial Consulting,HKD ($),15K - 50K per month,2024-09-19
HNW Wealth Management Manager,Roy Financial Consulting,HKD ($),15K - 50K per month,2024-09-19
FB and IG editor,Hong Kong Christian Cancer Care Association,HKD ($),50 - 55 per hour,2024-09-16
Assistant Executive/ Executive Order Management Apparel & Accessories,World Cat Limited,HKD ($),Negotiable,2024-09-17
啟德Sogo女裝鞋店務員,Grandioso Group Limited,HKD ($),65 - 80 per hour,2024-09-19
Library Assistant II in Library (Access Services Section) (Ref: 2400924),The Education University of Hong Kong,HKD ($),21.4K per month,2024-09-03
Assistant to Chairman,Sheraton Valuers Limited,HKD ($),20K - 30K per month,2024-09-19
Audit Senior,"WWC Professional Corporation Limited, CPAs (Practising)",HKD ($),24K - 40K per month,2024-09-16
Assistant,Alles Compliance Consulting Limited,HKD ($),16K - 19K per month,2024-09-14
Multimedia/Graphic Designer,Adbees Digital Limited,HKD ($),40 - 60 per hour,2024-09-19
Family Financial Planning Consultant,The HAIDER Family Office Limited,HKD ($),20K - 30K per month,2024-09-19
Teaching Position (STEM Education) for Academic Year 2024-2025 (Part-time: hourly-based),Edvenue Limited,HKD ($),155 - 230 per hour,2024-08-31
Application Engineer (Equipment),Teltec Semiconductor Pacific Ltd,HKD ($),15K - 30K per month,2024-09-19
General Practice Surveying Intern,CHFT Advisory & Appraisal Limited,HKD ($),Negotiable,2024-09-03
Service Engineer (Equipment),Teltec Semiconductor Pacific Ltd,HKD ($),15K - 30K per month,2024-09-19
行政助理 (AA) (合約) (編號 :EOL/88024),St. James' Settlement,HKD ($),Negotiable,2024-08-30
Multimedia/Graphic Designer,Adbees Digital Limited,HKD ($),40 - 60 per hour,2024-09-19
兒童普通話故事課程導師,iSpeech Limited,HKD ($),Negotiable,2024-09-06
Marketing Assistant,Target Winway International Limited,HKD ($),400 - 450 per day,2024-09-13
SEO Intern,First Page Limited,HKD ($),60 - 65 per hour,2024-09-14
Full-time Wealth Management Manager with monthly bonus,ALAN DONALD CO,HKD ($),15K - 50K per month,2024-09-19
Wealth Management Internship,ALAN DONALD CO,HKD ($),15K - 50K per month,2024-09-19
Assistant Editor (Geography),Ling Kee Publishing Co Ltd,HKD ($),18K - 19K per month,2024-09-19
Part-time Job: Editorial Assistant (Geography),Ling Kee Publishing Co Ltd,HKD ($),500 - 600 per day,2024-09-19
Sales Associate/Senior Sales Associate,E-FRAN HK LIMITED,HKD ($),Negotiable,2024-09-19
English Storytelling Tutor,iSpeech Limited,HKD ($),120 - 150 per hour,2024-09-06
Research Scientist / Research Assistant,WSC Holding Limited,HKD ($),18K - 23K per month,2024-09-16
Student Mentor,Hong Kong Scholars Education and Philanthropy Foundation Limited,HKD ($),1.25K per month,2024-09-19
Accounts Clerk,K. Wah Construction Materials (Hong Kong) Limited,HKD ($),Negotiable,2024-09-15
E-Commerce Officer,Hong Kong Technology Venture Company Limited,HKD ($),17K - 22K per month,2024-09-19
Audit assistant,Stella W.M. Kwok & Co,HKD ($),18K per month,2024-09-18
Personal Tutor,Sylvia Education Limited,HKD ($),5K - 8K per month,2024-09-19
Family Financial Planning Consultant,The HAIDER Family Office Limited,HKD ($),20K - 30K per month,2024-09-19
Bank Operation intern(Retail Banking Services),ZhongAn Technologies International Group Limited,HKD ($),50 per hour,2024-09-10
Recruitment Consultant,Recruit Express (Hong Kong) Limited,HKD ($),17K - 20K per month,2024-09-08
"(Campus recruiting-1 year contract)Officer, Investment Customer Services(type 1)",ZhongAn Technologies International Group Limited,HKD ($),18K - 22K per month,2024-09-19
Accenture Song - Digital Marketing PMO Analyst,Accenture Company Limited,HKD ($),Negotiable,2024-09-19
Investment Analyst (Crypto),Spartan Capital (HK) Limited,HKD ($),Negotiable,2024-09-19
STEM / AI Instructor - Freelance,Una Technologies Limited,HKD ($),180 - 230 per hour,2024-09-19
Merchandiser / Assistant Merchandiser (Garment),Excellent Jade Limited,HKD ($),16K - 21K per month,2024-08-31
Web Designer Intern,Young Living Hong Kong Limited,HKD ($),60 - 70 per hour,2024-09-19
Part Time Digital Ad Assistant,Hong Kong Technology Venture Company Limited,HKD ($),60 - 80 per hour,2024-09-19
"Teaching Assistant (Citizenship, Economics and Society / Citizenship and Social Development)",Good Hope School,HKD ($),17K - 17.5K per month,2024-09-04
Intern - Low Code Development,Lidl & Kaufland Asia Pte. Limited,HKD ($),Negotiable,2024-09-19
Assistant Quantity Surveyor,K. Wah Construction Materials (Hong Kong) Limited,HKD ($),Negotiable,2024-09-19
Administration Assistant,K. Wah Construction Materials (Hong Kong) Limited,HKD ($),Negotiable,2024-09-15
Digital Content Creator / Copywriter- English/ Chinese,Adbees Digital Limited,HKD ($),40 - 60 per hour,2024-09-19
(Part Time / Freelance) HairStyling Tutor 兼職 髮型 導師,Life Learn Limited,HKD ($),200 - 350 per hour,2024-09-18
臨時推廣員 (工展會),Tung Chun Management Services Co. Limited,HKD ($),65 - 70 per hour,2024-09-18
(Part Time / Freelance) HairDye Tutor 兼職 染髮 導師,Life Learn Limited,HKD ($),200 - 350 per hour,2024-09-18
(Part Time / Freelance) K-Pop Dance Tutor 兼職 K-Pop 排舞導師,Life Learn Limited,HKD ($),200 - 350 per hour,2024-09-18
(Part Time / Freelance) Street Dance Tutor 兼職 街舞 排舞導師,Life Learn Limited,HKD ($),200 - 350 per hour,2024-09-18
(Part Time / Freelance) Breaking Tutor 兼職 霹靂舞 導師 排舞導師,Life Learn Limited,HKD ($),200 - 350 per hour,2024-09-18
Social Media Marketing Intern (Unpaid),Talk To You Later LTD,HKD ($),Negotiable,2024-09-15
Software Engineer,Visutech Asia Limited,HKD ($),70 - 75 per hour,2024-09-18
Procurement and Supply Chain Officer,Earth Products China Limited,HKD ($),23K - 28K per month,2024-09-17
Mobile Application Developer,Bright Smart Securities International (HK) Ltd.,HKD ($),Negotiable,2024-08-31
Intern - Structured Finance Department,CMB International Capital Corporation Limited,HKD ($),50 per hour,2024-09-02
Sales & Marketing Assistant,Tung Chun Management Services Co. Limited,HKD ($),16K - 18K per month,2024-09-18
Teaching Assistant (Science KLA),Good Hope School,HKD ($),17K - 17.5K per month,2024-09-03
Management Trainee (Part-time Internship),Premiere Logistics (HK) Limited,HKD ($),45 - 60 per hour,2024-08-31
Management Trainee (Full time),Premiere Logistics (HK) Limited,HKD ($),13K - 18K per month,2024-08-31
ADMINISTRATIVE OFFICER,Premiere Logistics (HK) Limited,HKD ($),14K - 20K per month,2024-08-31
Analyst - Sales Support (CDD/KYC) (Entry Level),FundPark limited,HKD ($),18K - 20K per month,2024-08-30
Officer - Credit Policy & Analytics Department,Chong Hing Bank Limited,HKD ($),18K - 20K per month,2024-09-13
Senior Research Assistant in Department of Curriculum and Instruction (Ref: 2400925),The Education University of Hong Kong,HKD ($),29.1K per month,2024-09-03
Analyst Programmer,Bright Smart Securities International (HK) Ltd.,HKD ($),Negotiable,2024-08-31
技術員,Carewin Engineering Limited,HKD ($),12K - 15K per month,2024-09-14
Wealth Management Trainee,Nobleson Finance,HKD ($),45K - 60K per month,2024-08-26
劃圖員,Carewin Engineering Limited,HKD ($),15K - 18K per month,2024-09-14
Development Engineer,"AN LIAO CONSULTING CO., LIMITED",HKD ($),30K - 50K per month,2024-09-18
Technician (系統維修技術員) Part-time,Ground Transportation Systems (Hong Kong) Limited,HKD ($),14K - 20K per month,2024-09-17
【#IBtutor】IB Bio/Chem Tutor Recuritment - HIGH PAY,HKExcel Education Limited,HKD ($),20K - 30K per month,2024-08-31
"Pre-Sales Engineer, IT Solution",ICO Limited,HKD ($),18K - 20K per month,2024-09-18
量化开发工程师,上海明汯投资管理有限公司,CNY (¥),35K per month,2024-09-18
量化研究员,上海明汯投资管理有限公司,CNY (¥),35K - 50K per month,2024-09-18
Blockchain Developer,Amber AM Limited,HKD ($),25K - 28K per month,2024-09-14
机器学习开发工程师,上海明汯投资管理有限公司,CNY (¥),35K - 50K per month,2024-09-18
机器学习算法研究员,上海明汯投资管理有限公司,CNY (¥),35K - 50K per month,2024-09-18
Recruiting Facilitators (組爸媽) for “Smoke-free Elite Teens Programme” 2024-2025,Hong Kong Council on Smoking and Health,HKD ($),67 per hour,2024-09-09
【#IBtutor】IB Math/Physics Tutor Recuritment - HIGH PAY,HKExcel Education Limited,HKD ($),20K - 30K per month,2024-08-31
Associate Systems Analyst,HKR International Limited,HKD ($),Negotiable,2024-09-18
Senior Research Assistant / Research Assistant I / II in Research and Development Office (Knowledge Transfer Sub-Office) (4 posts) (Ref: 2400871),The Education University of Hong Kong,HKD ($),29.1K per month,2024-09-03
Internship,Greater Bay Area Homeland Investments Limited,HKD ($),Negotiable,2024-09-18
Content Marketer,Mindful Wing Chun Limited,HKD ($),18K - 22K per month,2024-09-08
AI Research Intern,Insight Robotics Limited,HKD ($),80 - 90 per hour,2024-08-31
AIA Graduate Program for fresh graduates/IANG/TTPS/QMAS,MVP Professional Financial Consultancy Company,HKD ($),35K - 50K per month,2024-09-17
Administration Assistant,Montagut Far East Limited,HKD ($),16K - 18K per month,2024-09-18
Sales & Marketing Internship,ParkIt Hong Kong,HKD ($),8K - 10K per month,2024-09-15
Business Development Intern/Graduate (Part Time),Alpha AI Technology Limited,HKD ($),500 - 650 per day,2024-09-10
Project Administration Executive,FDS Solutions Limited,HKD ($),20K - 22K per month,2024-09-15
"Part-time Recruiter (Listed MNC, Regional Exposure)",Recruitfirst Limited,HKD ($),60 - 70 per hour,2024-09-18
"教育平台 (OpenAI, React, Laravel) 編程 Developer","e-Learning Development Laboratory, The University of Hong Kong",HKD ($),16K - 24K per month,2024-09-18
STEM Project Officer for K12 STEM Education,"e-Learning Development Laboratory, The University of Hong Kong",HKD ($),18.5K - 23K per month,2024-09-18
"Intern, Technical Accounting",Peak Reinsurance Company Limited,HKD ($),Negotiable,2024-09-18
Logistics Coordinator (Air Export - Gateway),Expeditors Hong Kong Limited,HKD ($),15K - 20K per month,2024-08-31
Investment Consultancy Trainee,The HAIDER Family Office Limited,HKD ($),18K - 25K per month,2024-09-18
"小學導師 (5.5日)( 大埔太和)/Primary School Tutor (5.5DAYS)( Tai Wo, Tai Po)",Bright Union International Limited,HKD ($),15K - 17K per month,2024-09-03
小學導師 (6日) (粉嶺)/Primary School Tutor (6DAYS) (Fanling),Bright Union International Limited,HKD ($),21K per month,2024-09-03
"小學導師 (5.5天) (屯門盈豐)/Primary school tutor (5.5 Days) (GoodRich, Tuen Mun)",Bright Union International Limited,HKD ($),17K per month,2024-09-03
"小學導師 (5.5天) (天水圍天澤)/Primary school tutor (5.5 Days) (Tin Chak, Tin Shui Wai)",Bright Union International Limited,HKD ($),17K per month,2024-09-03
"小學導師 (5.5天) (天水圍銀座)/Primary school tutor (5.5 Days) (Ginza ,Tin Shui Wai)",Bright Union International Limited,HKD ($),17K per month,2024-09-03
小學導師 (5.5天) (屯門市中心),Bright Union International Limited,HKD ($),17K per month,2024-09-03
公民與社會發展科導師 (5天) /CSD Tutor(5 days),Bright Union International Limited,HKD ($),22K per month,2024-09-04
高中經濟及BAFS企會財導師 (5天)/DSE BAFS & Economics Tutor (5 days),Bright Union International Limited,HKD ($),22K - 23K per month,2024-09-04
Primary Textbook Editing Translator (Graduate Job),"e-Learning Development Laboratory, The University of Hong Kong",HKD ($),16K - 22K per month,2024-09-18
初中英文導師(6天) (粉嶺),Bright Union International Limited,HKD ($),20K - 22K per month,2024-09-04
Part-time - Membership Services Assistant – Hotline (General Enquiry & Members Mobile App),The Hong Kong Jockey Club,HKD ($),88 per hour,2024-09-16
Part-time Property Assistant (Call Centre),The Hong Kong Jockey Club,HKD ($),Negotiable,2024-09-16
English Writer,Koomen International Company Limited,HKD ($),70 - 100 per hour,2024-09-18
Sales Support (re-design of sales/accounting tools),Lufthansa Cargo Aktiengesellschaft,HKD ($),Negotiable,2024-09-15
Part Time Tutor (Secondary English),Arsenal Training Consultancy,HKD ($),200 per hour,2024-09-18
Part Time Tutor (Primary English),Arsenal Training Consultancy,HKD ($),200 per hour,2024-09-18
Part Time Tutor (Primary English),Arsenal Training Consultancy,HKD ($),200 per hour,2024-09-18
Part Time Tutor (Secondary Chinese),Arsenal Training Consultancy,HKD ($),140 per hour,2024-09-18
Part Time Tutor (Secondary Chemistry and Junior Secondary Integrated Science and Maths),Arsenal Training Consultancy,HKD ($),140 per hour,2024-09-18
Part Time Tutor (Secondary Physics and Junior Secondary Integrated Science and Maths),Arsenal Training Consultancy,HKD ($),140 per hour,2024-09-18
Part Time Tutor (Secondary Biology & Junior Secondary Maths and Integrated Science),Arsenal Training Consultancy,HKD ($),140 per hour,2024-09-18
Part Time Tutor (Secondary BAFS & Maths),Arsenal Training Consultancy,HKD ($),140 per hour,2024-09-18
Primary Tutor (Part-time),Arsenal Training Consultancy,HKD ($),90 - 100 per hour,2024-09-18
SCRATCH & PYTHON COMPUTER PROGRAMMING TUTOR,Arsenal Training Consultancy,HKD ($),200 per hour,2024-09-18
"Intern, Climate Consulting (till Year-end 2024)",AXA China Region Insurance Company Limited,HKD ($),80 per hour,2024-09-18
Education Executive Officer (Graduate Job),"e-Learning Development Laboratory, The University of Hong Kong",HKD ($),16K - 20K per month,2024-09-18
兼職專科班導師 (何文田 半山壹號),MODERN BACHELOR EDUCATION CENTRE (CELESTIAL HEIGHTS),HKD ($),120 - 200 per hour,2024-09-18
兼職功課輔導班導師 (何文田 半山壹號),MODERN BACHELOR EDUCATION CENTRE (CELESTIAL HEIGHTS),HKD ($),80 - 150 per hour,2024-09-18
IT and Science Education Project Officer,"e-Learning Development Laboratory, The University of Hong Kong",HKD ($),16K - 20K per month,2024-09-18
Internship Programme 2024 – Countryside Conservation and Environmental Education,Association for Sha Tau Kok Culture and Ecology Limited,HKD ($),Negotiable,2024-09-18
Officer (Treasury & Accounting Operations),Vanke Holdings (Hong Kong) Company Limited,HKD ($),25K - 30K per month,2024-09-14
Analyst Programmer,Vanke Holdings (Hong Kong) Company Limited,HKD ($),25K - 30K per month,2024-09-12
Part-time Digital Marketing Intern/Assistant,Synergy International Group Limited,HKD ($),55 - 60 per hour,2024-09-17
[在家工作] 線上教育兼職導師 Part-time Teacher - online teaching,Dr. Kids Education Group Limited,HKD ($),60 - 120 per hour,2024-09-17
Recruitment Intern / Trainee,Recruit Express (Hong Kong) Limited,HKD ($),55 - 60 per hour,2024-09-08
Junior Quantitative Analyst(Ref: AQ-152-U),BOCI-Prudential Asset Management Limited,HKD ($),Negotiable,2024-09-17
Assistant Officer (Fresh graduates are welcome),Chevalier (Corporate Management) Limited,HKD ($),Negotiable,2024-08-26
全職數學教師（母語廣東話）,Star Ace Education,HKD ($),Negotiable,2024-09-11
Graduate Trainee - System Consultant,Global Sharp International Limited,HKD ($),25K - 27K per month,2024-09-02
"Analyst, Corporate Finance (6-month renewable contract)",Asian Capital Limited,HKD ($),Negotiable,2024-09-06
AI Digital Human Developer,Digital Human International (A.I.) Company LImited,HKD ($),18K - 20K per month,2024-09-15
Placement Trainee (Infrastructure Financing and Securitisation),The Hong Kong Mortgage Corporation Limited,HKD ($),Negotiable,2024-09-01
Quantitative Analyst,Ctech Group Limited,HKD ($),30K - 50K per month,2024-09-17
Junior Trader,Ctech Group Limited,HKD ($),30K - 50K per month,2024-09-17
Business Development Executive,Ctech Group Limited,HKD ($),30K - 50K per month,2024-09-17
Programmer Analyst,Ctech Group Limited,HKD ($),40K - 60K per month,2024-09-17
HR & Administration Officer/ Assistant Manager,PROMO X LIMITED,HKD ($),16K - 18K per month,2024-08-26
Assistant Digital Engineer - Smart Construction,SOCAM Development Limited,HKD ($),Negotiable,2024-08-31
Assistant Engineer (Telecom),SHUN HING SYSTEMS INTEGRATION COMPANY LIMITED,HKD ($),18K - 20K per month,2024-09-17
Intern - Equity Research Department,CMB International Capital Corporation Limited,HKD ($),Negotiable,2024-09-15
Assistant Engineer (Mechanical),SHUN HING SYSTEMS INTEGRATION COMPANY LIMITED,HKD ($),18K - 20K per month,2024-09-17
Assistant Human Resources Officer,SHUN HING SYSTEMS INTEGRATION COMPANY LIMITED,HKD ($),17K - 19K per month,2024-09-17
"Part Time Trainee Engineer, Building Services",Benchmark Consulting Engineers Ltd,HKD ($),90 per hour,2024-09-15
Assistant Engineer (Electrical),SHUN HING SYSTEMS INTEGRATION COMPANY LIMITED,HKD ($),18K - 20K per month,2024-09-17
"Part-time Associate, Human Resources",Shanghai Commercial Bank Limited,HKD ($),Negotiable,2024-08-31
Project Assistant (5-Day Work),Centaline Group Management Limited,HKD ($),18K - 20K per month,2024-09-15
Part Time Administrative Assistant,DLC Advisory Services,HKD ($),Negotiable,2024-09-17
MPFA Student Ambassadors for 2024-25,Mandatory Provident Fund Schemes Authority,HKD ($),Negotiable,2024-08-26
Management Trainee (Oversea),Bright Future Pharmaceutical Laboratories Limited,HKD ($),12K - 20K per month,2024-09-01
Junior Programmer (Machine Learning / AI),Ctech Group Limited,HKD ($),40K - 60K per month,2024-09-17
Engineer,Mitochon Technology Limited,HKD ($),18K - 24K per month,2024-09-10
Project Intern - Derivatives Structuring,Huatai Financial Holdings (Hong Kong) Limited,HKD ($),11K - 12K per month,2024-09-17
Business Trainee,i-Control Limited,HKD ($),Negotiable,2024-09-13
Management Trainee,Ctech Group Limited,HKD ($),30K - 50K per month,2024-09-17
Program Officer,Acme Pro Limited,HKD ($),Negotiable,2024-09-17
Field Service Engineer,Vastec Medical Limted,HKD ($),Negotiable,2024-09-17
Engineer,Shinryo (Hong Kong) Limited,HKD ($),Negotiable,2024-09-17
Business Analyst - Graduate Program (Various Opportunities),Fides Solutions Limited,HKD ($),20K - 23K per month,2024-09-17
Business Analyst / Data Analyst,Fides Solutions Limited,HKD ($),18K - 19K per month,2024-09-17
Junior Developer / Programmer (Business Application),Fides Solutions Limited,HKD ($),20K - 23K per month,2024-09-17
Business Development Executive,HKCOLO Limited,HKD ($),19K - 22K per month,2024-09-17
Admin Intern,Magic Compass Securities Limited,HKD ($),60 - 80 per hour,2024-08-26
Management Trainee / Internship Program (2024),YEE CHUN KEI KINGSLEY,HKD ($),18K - 20K per month,2024-08-31
Assistant (Business Development),Midland Realty (Strategic) Limited,HKD ($),15K - 16K per month,2024-09-17
Accounting Officer,Cornerstone EV Charging Service Limited,HKD ($),18K - 22K per month,2024-09-17
(荃灣) 兼職助教/導師 Teaching Assistant,Intellectual Education Centre,HKD ($),70 - 140 per hour,2024-09-17
"小學導師 (5.5天) (屯門友愛)/ Primary school tutor (5.5 Days) (Yau Oi, Tuen Mun)",Bright Union International Limited,HKD ($),17K per month,2024-09-03
Business Analyst,Ctech Group Limited,HKD ($),30K - 50K per month,2024-09-17
Operation Officer,Ctech Group Limited,HKD ($),30K - 50K per month,2024-09-17
Assistant Officer (Property Administration),Midland Realty (Strategic) Limited,HKD ($),16K - 18K per month,2024-09-16
Surveying Assistant (Part-time),Midland Realty (Strategic) Limited,HKD ($),50 - 55 per hour,2024-09-15
Marketing Assistant (E-Marketing),Zinnia Marketing & PR Consultants Limited,HKD ($),60 - 90 per hour,2024-09-16
Graduate Engineer,APT Engineering Consultant Limited,HKD ($),24K per month,2024-09-14
"Full time Chinese tutor(廣東話母語, 年齡18-30)(需要DSE中文5或以上或同等資歷)",Star Ace Education,HKD ($),30K - 80K per month,2024-09-10
"中小學導師 (5/6天) (觀塘安達)/Secondary School and Primary School Tutor (5 /6days) (On Tat Estate, Kwun Tong)",Bright Union International Limited,HKD ($),18.5K per month,2024-08-31
Counter Service Officer Trainee / Teller Trainee,Chong Hing Bank Limited,HKD ($),17K per month,2024-09-10
Administrative Assistant,Grace Christian Academy,HKD ($),14K - 18K per month,2024-09-15
"小學導師 (6日) (沙田馬鞍山)/Primary School Tutor (6 DAYS) (Ma On Shan, Shatin)",Bright Union International Limited,HKD ($),17.5K per month,2024-08-31
Assistant Safety Officer,Quon Hing Concrete Co Ltd,HKD ($),18K - 22K per month,2024-09-14
"小學導師 (6日) (沙田禾輋)/Primary School Tutor (6 DAYS) (Wo Che, Shatin)",Bright Union International Limited,HKD ($),18K per month,2024-08-31
"小學導師(5/6天) (觀塘安達)/ Primary School Tutor (5/6 DAYS) (On Tat Estate, Kwun Tong)",Bright Union International Limited,HKD ($),21K per month,2024-08-31
"中小學導師 (5/6天) (葵涌石蔭)/Secondary School and Primary School Tutor (5/6days) (Shek Yam, Kwai Chung)",Bright Union International Limited,HKD ($),18.5K per month,2024-08-31
中小學導師 (5-6天) (天水圍)/Secondary School and Primary School Tutor (5-6 days) (Tin Shui Wai),Bright Union International Limited,HKD ($),17K - 18K per month,2024-08-31
中小學導師 (6天) (屯門市中心)/Secondary School and Primary School Tutor(6 days) (Tuen Mun Town Centre)),Bright Union International Limited,HKD ($),17K - 18K per month,2024-08-31
"中小學導師 (6天) (石硤尾白田)/Secondary School and Primary School Tutor (6ays) (Pak Tin Estate,Shek Kip Mei)",Bright Union International Limited,HKD ($),19K per month,2024-08-31
Clubhouse Assistant,Protech Property Management Limited,HKD ($),15.5K - 18K per month,2024-09-15
Assistant Property Officer - Tai Tam,Protech Property Management Limited,HKD ($),20K - 22K per month,2024-09-15
"中小學導師 (5.5天) (大埔太和)/Secondary School and Primary School Tutor (5.5ays) (Tai Wo, Tai Po)",Bright Union International Limited,HKD ($),15K - 16K per month,2024-08-31
Secondary School Social Worker,The Boys' & Girls' Clubs Association of Hong Kong(HQ),HKD ($),Negotiable,2024-08-25
"中小學導師 (6天) (沙田馬鞍山)/Secondary School and Primary School Tutor (6days) (Ma On Shan, Shatin)",Bright Union International Limited,HKD ($),20K per month,2024-08-31
Actuarial Intern (2025 Internship),Fubon Life Insurance (Hong Kong) Company Limited,HKD ($),Negotiable,2024-09-15
Senior Education & Project Office/ Education & Project Officer (Ref.: SEPO/ EPO_Jijis2408),Green Power Limited,HKD ($),Negotiable,2024-09-15
Account Executive,McCANN-Erickson (HK) LTD,HKD ($),15K - 16K per month,2024-09-13
Business Analyst,Global Sharp International Limited,HKD ($),23K - 27K per month,2024-08-31
BIM Trainee,Takasago Thermal Engineering (Hong Kong) Company Limited,HKD ($),15K - 16K per month,2024-09-15
Sales Manager,Wanfang Data Corporation (International) Limited,HKD ($),17K - 19K per month,2024-09-15
Assistant Officer – Graduate School (Ref: AO (GS) 2024-08-16),The Hang Seng University of Hong Kong,HKD ($),Negotiable,2024-09-01
Graduate Intern (Development - Hong Kong Palace Museum),West Kowloon Cultural District Authority,HKD ($),16K per month,2024-09-14
